{
  "prospect": {
    "name": "Nimble",
    "slug": "nimble",
    "website": "https://nimbledata.com",
    "industry": "Web Data Collection",
    "logoType": "text",
    "logoText": "NIMBLE",
    "logoHighlightLetters": "L"
  },
  "branding": {
    "primaryColor": "#7c8dff",
    "secondaryColor": "#c1aaf3",
    "lightColor": "#e8e6ff",
    "hoverColor": "#6b7ce8"
  },
  "messaging": {
    "heroTitle": "Self service customer integrations",
    "heroHighlight": "out of the box",
    "heroSubtitle": "Give Nimble the data delivery customers expect. Enable seamless connections to customer warehouses, cloud storage, and internal systems with flexible syncs and effortless write-back, delivered via white-glove onboarding or in-product self-service and powered by SK8's proven infrastructure.",
    "splashTitle": "Welcome to Nimble's Data Delivery Section",
    "splashSubtitle": "This is where Nimble customers manage their data sources. Data infrastructure is powered by SK8 as well as the UI using embedded, customized UI components or APIs",
    "competitors": ["Bright Data", "Oxylabs", "Smartproxy"]
  },
  "integrations": {
    "category": "Source",
    "categoryPlural": "Sources",
    "items": [
      {
        "name": "Snowflake",
        "type": "Data Warehouse",
        "icon": "snowflake.svg",
        "description": "Ingest customer and transaction data from your Snowflake data warehouse.",
        "dataObjects": [
          { "name": "CUSTOMERS", "description": "Customer master data", "volume": "~500K records" },
          { "name": "ORDERS", "description": "Transaction history", "volume": "~2.1M/month" },
          { "name": "ANALYTICS_EVENTS", "description": "User behavior tracking", "volume": "~5M/month" },
          { "name": "PRODUCTS", "description": "Product catalog", "volume": "~50K records" }
        ]
      },
      { "name": "Databricks", "type": "Lakehouse", "icon": "databricks.svg", "description": "Sync data from your Databricks lakehouse for unified analytics." },
      { "name": "BigQuery", "type": "Data Warehouse", "icon": "bigquery.svg", "description": "Connect to BigQuery to ingest analytics and reporting data." },
      { "name": "AWS S3", "type": "Object Storage", "icon": "s3.svg", "description": "Ingest files and data exports from your S3 buckets." },
      { "name": "GCS", "type": "Object Storage", "icon": "gcs.svg", "description": "Sync data from Google Cloud Storage buckets." },
      { "name": "Custom API", "type": "Webhook/REST", "icon": "api.svg", "description": "Connect to any REST API or webhook endpoint to ingest custom data." }
    ]
  },
  "navigation": {
    "sectionLabel": "Data Sync",
    "menuItems": [
      {
        "id": "overview",
        "label": "Sync Overview",
        "tooltip": "Dashboard showing all active syncs, health metrics, and recent activity"
      },
      {
        "id": "add",
        "label": "Add Source",
        "tooltip": "Configure a new data source: warehouse, cloud storage, or API"
      },
      {
        "id": "active",
        "label": "Active Sources",
        "tooltip": "View and manage your connected data sources"
      },
      {
        "id": "history",
        "label": "Sync History",
        "tooltip": "Browse sync logs, sync status, and historical data"
      }
    ]
  },
  "features": [
    {
      "title": "Real-time Sync",
      "description": "Stream data as it's collected",
      "icon": "<svg width=\"20\" height=\"20\" viewBox=\"0 0 24 24\" fill=\"none\" stroke=\"currentColor\" stroke-width=\"2\"><polyline points=\"22 12 18 12 15 21 9 3 6 12 2 12\" /></svg>"
    },
    {
      "title": "Enterprise Security",
      "description": "SOC 2 compliant, encrypted",
      "icon": "<svg width=\"20\" height=\"20\" viewBox=\"0 0 24 24\" fill=\"none\" stroke=\"currentColor\" stroke-width=\"2\"><path d=\"M12 22s8-4 8-10V5l-8-3-8 3v7c0 6 8 10 8 10z\" /></svg>"
    },
    {
      "title": "Schema Mapping",
      "description": "Map fields to your schema",
      "icon": "<svg width=\"20\" height=\"20\" viewBox=\"0 0 24 24\" fill=\"none\" stroke=\"currentColor\" stroke-width=\"2\"><rect x=\"3\" y=\"3\" width=\"18\" height=\"18\" rx=\"2\" ry=\"2\" /><line x1=\"3\" y1=\"9\" x2=\"21\" y2=\"9\" /><line x1=\"9\" y1=\"21\" x2=\"9\" y2=\"9\" /></svg>"
    }
  ]
}
